,author,content,description,publishedAt,source,title,url,full_art
17,Tory Newmyer,"THE TICKER
Charles Koch. (Bo Rader/The Wichita Eagle)
The Koch brothers political arm is conceding it has lost the early fight in its battle against President Trumps tariffs. 
The powerhouse right-wing group remains committed to the cause. But its leaders … [+14679 chars]",The rightwing powerhouse says it will retool its strategy.,2019-09-20,The Washington Post,The Finance 202: Koch network admits its push against Trump's tariffs has fallen flat,https://www.washingtonpost.com/news/powerpost/paloma/the-finance-202/2019/09/20/the-finance-202-koch-network-admits-its-push-against-trump-s-tariffs-has-fallen-flat/5d8414d8602ff1737aef732b/,"THE TICKER

Charles Koch. (Bo Rader/The Wichita Eagle)

The Koch network is conceding it has lost the early fight in its battle against President Trump’s tariffs.

The powerhouse rightwing group funded partly by billionaire industrialist Charles Koch remains committed to the cause. But its leaders are acknowledging their attempt to turn voters against Trump’s preferred weapon in his trade wars through a massive political advertising campaign has mostly fallen flat and the strategy needs retooling, as CNBC’s Brian Schwartz was the first to report.

“We remain fully committed to free trade and are always adjusting our plans and tactics,” an official with Americans for Prosperity, the Koch grass-roots lobbying group, tells me in an email. “Tariffs are destructive, but we recognize that the economic toll is diffuse and not felt evenly among all Americans.”

That is, only a relatively small slice of the population has suffered acutely from Trump’s escalating import duties. That cohort includes farmers, manufacturers, and some in the retail and tech industries. But many continue backing Trump and his trade offensive nevertheless. And so do everyday consumers who haven’t felt enough pain to reassess their support of the president’s strategy.

Polls bear out the Koch group’s finding. The most recent Washington Post-ABC News poll, for example, found while 56 percent of voters say they disapprove of his trade offensive against China, another 35 percent approve, a number that aligns roughly with his overall support. Similarly, 6 in 10 said they are worried the confrontation with China will drive up the price of household staples, while 4 in 10, a healthy minority, said they were less concerned.

And the White House has doubled down on a strategy for bailing out at least one of the constituencies pinched hardest by its tit-for-tat with Beijing. The administration is doling out $28 billion in relief to farmers, a tab that makes the program “more than twice as expensive as the 2009 bailout of Detroit’s Big Three automakers, which cost taxpayers $12 billion,” Bloomberg News’s Mario and Mike Dorning write. “And farmers expect the money to keep flowing: In an August survey by Purdue University and the CME Group, 58% said they anticipate another round of trade aid next year.”

President Trump speaks at Southwest Iowa Renewable Energy, an ethanol producer in Council Bluffs, Iowa, in June. (AP Photo/Nati Harnik)

The polling and the Koch group’s pivot point to an advantage for the Trump team, and a challenge facing Democrats as they seek to put the economy front and center in the 2020 campaign. Economists agree the trade war is taking a meaningful bite out of growth at home, with Fed researchers pegging the damage at a full percentage point through the early part of next year. The conflict has stoked concerns it will hurry the arrival of the next recession.

But it’s arguably less clear Trump’s tariffs are diminishing his support among his base. “The argument that, you know, the tariffs are adding a couple thousand dollars to the pickup truck that you’re buying is not persuasive,” a senior Koch official told CNBC’s Schwartz. “It doesn’t penetrate with the people that are willing to go along with the argument that you have to punish China.”

The Koch network hasn’t yet settled on its next strategy. But it appears aimed at taking advantage of growing popular support for free trade generally. “You can look for us to engage in making the benefits of trade – taken for granted for decades - more widely appreciated,” the official told me. “Ultimately that will impact our nation's trade policy more favorably for the benefit of more Americans.""

The group first entered the fray over Trump’s trade offensive in June 2018. At the time, it pledged to wage a multiyear, multimillion-dollar campaign against the imposition of tariffs, just days after Trump slapped duties on steel and aluminum imports and prepared the first round of duties on $50 billion of Chinese goods. Now, $250 billion of Chinese imports face a 25 percent tariff, and another $112 billion face a 15 percent tariff. And Trump has pledged to further dial up the import taxes next month and again in December.

Mid-level negotiations between the countries resumed this week, an attempt to lay a foundation for more senior-level talks next month. But expectations for a breakthrough remain low.

You are reading The Finance 202, our must-read tipsheet on where Wall Street meets Washington. Not a regular subscriber?

MARKET MOVERS

Stock traders John Santiago, left, and Paul Cosentino work at the New York Stock Exchange. (AP Photo/Mark Lennihan)

— Pressure grows for permanent fix after repo mess. Bloomberg's Liz McCormick and Alex Harris: ""Signs that stress in U.S. funding markets is rebuilding ramped up pressure on the Federal Reserve to permanently increase reserves by boosting Treasury holdings, even as it was preparing a temporary liquidity injection for a fourth straight day. The New York Fed plans to do another $75 billion overnight repo operation on Friday. It follows liquidity doses of the same size Thursday and Wednesday, and $53.2 billion on Tuesday. The central bank is deploying this remedy for the first time in a decade.

""This week’s actions have helped calm the funding market, with repo rates declining to more normal levels after soaring to 10% Tuesday, four times last week’s levels. However, swap spreads tumbled to record lows Thursday amid concern Fed policy makers haven’t announced more aggressive steps. Swaps are signaling less appetite for Treasuries, driven by concern traders won’t be able to fund purchases through the repo market.""

— Pound jumps as Juncker opens door to Brexit deal. CNBC's Maggie Fitzgerald: ""The British pound jumped on Thursday after European Commission President Jean-Claude Juncker said he is confident a Brexit deal will get passed before the deadline. 'I think we can have a deal,' Juncker said in an interview with Sky News. 'I am doing everything to have a deal because I don’t like the idea of a no-deal because I think this would have catastrophic consequences for at least one year.' The pound rose 0.68% to 1.2553 against the dollar.""

TRUMP TRACKER

TRADE FLY-AROUND:

U.S. and Chinese flags displayed outside a hotel in Beijing. (Poornima Weerasekaragreg Baker/AFP/Getty)

— U.S.-China trade talks resume with large gulfs: “U.S. and Chinese deputy trade negotiators resumed face-to-face talks for the first time in nearly two months on Thursday, as the world’s two largest economies try to bridge deep policy differences and find a way out of their protracted trade war,” Reuters’s David Lawder reports.

“The negotiations, which will extend into Friday, are aimed at laying the groundwork for high-level talks in early October that will determine whether the two countries are working toward a solution or headed for new and higher tariffs on each other’s goods.”

Who’s leading the talks: “A delegation of about 30 Chinese officials, led by Vice Finance Minister Liao Min, met counterparts at the U.S. Trade Representative’s (USTR) office near the White House. Deputy USTR Jeffrey Gerrish led the U.S. delegation.”

“A delegation of about 30 Chinese officials, led by Vice Finance Minister Liao Min, met counterparts at the U.S. Trade Representative’s (USTR) office near the White House. Deputy USTR Jeffrey Gerrish led the U.S. delegation.” What’s on the table: “The discussions are seen focusing heavily on agriculture, including U.S. demands that China substantially increase purchases of American soybeans and other farm commodities, a person with knowledge of the planned discussions told Reuters. Two negotiating sessions over the two days will cover agricultural issues, while just one will be devoted to the strengthening of China’s intellectual property protections and the forced transfer of U.S. technology to Chinese firms.”

Michael Pillsbury: It can get a lot worse. The Hudson Institute scholar and White House whisperer on China matters warned that Trump can dramatically ramp up tariifs and use other means to pressure the Chinese if a deal isn't struck soon. ""“Does the president have options to escalate the trade war? Yes, the tariffs can be raised higher. These are low level tariffs that could go to 50 per cent or 100 per cent,” Pillsbury told the South China Morning Post. He said Trump's critics shouldn't assume he is bluffing: “There are other options involving the financial markets, Wall Street, you know, the president has a whole range of options.""

— Huawei makes its case in court: “Attorneys for China’s Huawei Technologies Co. argued in court … that a law barring it from doing business with U.S. government agencies is unconstitutional for selectively targeting the company for punishment using legislation,” the Wall Street Journal’s Tawnell D. Hobbs reports.

“U.S. attorneys asked for dismissal of the case, heard in the U.S. District Court in the Eastern District of Texas. Attorney Emily Newton with the U.S. Department of Justice argued that Congress had ample national security reasons for the legislation.”

Chinese trade negotiators plan to visit US farm country after Washington talks The move could bring a welcome salve to farmers caught in the crosshairs of the trade war if it results in a reopening of the market. CNBC

TRUMP WATCH:

President Donald Trump. (Jabin Botsford/The Washington Post)

— Trump sues to protect his tax returns, again: “[Trump] filed a lawsuit Thursday to block New York prosecutors’ subpoena for his tax returns, the latest salvo in a continuing battle over the disclosure of the president’s financial information,” WSJ’s Corinne Ramey reports.

“The suit, filed in federal court in Manhattan against Manhattan District Attorney Cyrus Vance Jr. and accounting firm Mazars USA LLP, comes in response to a subpoena state prosecutors sent last month to the accounting firm requesting eight years of personal and business tax returns. State prosecutors are examining whether a payment to former adult-film star Stormy Daniels — and how the reimbursement of that payment was recorded — violates a state law against falsifying business records.”

POCKET CHANGE

AT&T logo. (Alan Diaz, File/AP)

— AT&T CEO reportedly not focused on selling DirectTV: “Hedge fund Elliott Management is already turning the screws on AT&T, just 10 days after disclosing a $3.2 billion stake and calling for recommendations for improving leadership and operations,” CNBC’s Alex Sherman reports. “But AT&T is not yet feeling the pain.”

“AT&T is not focused on divesting or selling DirecTV, sources tell CNBC. Both options are being pushed by Elliott, which believes a Dish-DirecTV merger can get done in today’s regulatory environment even though such a deal was struck down in 2002, according to people familiar with the matter … Elliott could push harder on replacing AT&T CEO Randall Stephenson if AT&T resists splitting off DirecTV, according to people familiar with the matter.”

— A tale of two parties and economic realities: “America’s political polarization is almost complete. Its two main political parties increasingly represent two different economies. And they barely overlap,” WSJ’s Aaron Zitner and Dante Chinni reports.

“Democrats can be found in educated cities and suburbs where professional jobs are plentiful. Republicans live in working-class and rural communities, home to agriculture and low-skill manufacturing.”

Some examples:

GDP: “These days, Democratic House districts are doing substantially better: Two-thirds of the nation’s GDP comes from those areas, with Republican districts making up the rest.”

“These days, Democratic House districts are doing substantially better: Two-thirds of the nation’s GDP comes from those areas, with Republican districts making up the rest.” Household income: “A decade ago, median household income was about the same for each party. Since then, it has jumped nearly 17% in Democratic districts while falling 3% in Republican ones.”

— Bezos unveils climate change plan: “Amazon CEO Jeff Bezos unveiled a sweeping new plan on Thursday to tackle climate change, committing the retail giant to meet the goals of the Paris climate agreement 10 years ahead of schedule,” CNBC’s Annie Palmer reports.

“In what he is calling the ‘Climate Pledge,’ Bezos also promised to measure and report the company’s emissions on a regular basis, implement decarbonization strategies and alter its business strategies to offset remaining emissions. Bezos expects 80% of Amazon’s energy use to come from renewable sources by 2024, up from a current rate of 40%, before transitioning to zero emissions by 2030.” (Bezos also owns The Washington Post.)

Walmart’s Chief Executive to Chair the Business Roundtable Walmart C.E.O. Doug McMillon will head the C.E.O. trade group and replace JPMorgan’s chief, Jamie Dimon. NYT

Business Arthur Cashin, wise to the ways of Wall Street When the stock market whipsaws, CNBC turns to the 78-year-old dean of the New York Stock Exchange to make sense of it all. Thomas Heath

Business Overstock’s former CEO sells off his $90M stake, saying he’s worried about ‘Deep State’ Patrick Byrne abruptly quit the company last month after saying he'd been involved in multiple FBI investigations and had romanced Maria Butina — a Russian national later convicted of trying to influence American policy. Abha Bhattarai

MONEY ON THE HILL

Rep. Nita M. Lowey (D-N.Y.) speaks with Sen. Richard C. Shelby (R-Ala.), left, and Vice Chairman Patrick J. Leahy (D-Vt.) seen here in 2018. (Bonnie Jo Mount/The Washington Post)

— House averts shutdown ... until November: ""The House voted overwhelmingly Thursday to keep the government open through late November, setting up a huge showdown later this year over [Trump’s] border wall that could force another shutdown before Thanksgiving,"" my colleague Erica Werner reports.

""The short-term nature of Thursday’s legislation was the result of failed efforts to complete a broader spending package ahead of Sept. 30, when government funding is set to expire for multiple agencies. The need for the stopgap measure shows how fundamental spending issues between Democrats and Republicans remain unresolved, even though lawmakers believed they had dispatched the thorniest problems in a sweeping budget deal completed over the summer.

Sens. Bernie Sanders (I-Vt.) and Elizabeth Warren (D-Mass.). (Brendan Smialowski/AFP/Getty Images)

— Investors frightened over Warren presidency: “In a room full of avowed capitalists, policies that sound to some like socialism are bound not to go over well,” CNBC’s Jeff Cox and Yun Li report.

“That’s why the recent surge by Sen. Elizabeth Warren in the Democratic presidential race polls was jangling the nerves of some of the finance professionals gathered Thursday at the Delivering Alpha conference presented by CNBC and Institutional Investor.""

These quotes 👀:

‘They won’t open the stock market if Elizabeth Warren is the next president,’ joked Leon Cooperman, the legendary head of Omega Advisors.

“One financial pro, asked if he fears a Warren presidency, nodded vigorously and said, ‘Yeah, I do. Regardless of what you think about Trump, he’s been very good for the economy.’ ”

— Sanders sets small-donor record: “One million people have donated to Bernie Sanders' presidential campaign, his campaign said Thursday,” Politico’s Holly Otterbein reports. “He is the first candidate to announce reaching that milestone.”

“Sanders' team said more than 99 percent of his donors can contribute again because they have not yet given the maximum allowable donation. The campaign also said that 125,000-plus people are giving recurring monthly contributions to Sanders.”

For comparison:

“In 2008, Obama reached the 1-million mark in late February. In his first campaign for the White House, Sanders' campaign said he received donations from 1 million people by early January.”

“Warren has announced in June that she received 1 million donations, but not 1 million individual donors:

CHART TOPPER

Via Liz Ann Sonders, the most hated office jargon, ranked (and we admit we've never heard ""punch a puppy"" before):

THE FUNNIES

From The Post's Ann Telnaes:

For fun-loving protectionists this Halloween:

BULL SESSION"
