,author,content,description,publishedAt,source,title,url,full_art
104,Astead W. Herndon,"His son Ali Shakur, 27, said his guiding principle was simple: He wanted to support the candidate most committed to fundamental change.
Mr. Sanders and Ms. Warren tried to flex that young support after the debate. Mr. Sanders held a rally at Morehouse Colleg… [+1489 chars]","Joe Biden leads with black voters, and Elizabeth Warren and Bernie Sanders are making better inroads with younger ones than Kamala Harris and Cory Booker. In interviews, voters rejected the idea that racial representation equated to change.",2019-11-25,The New York Times,Black Voters to Black Candidates: Representation Is Not Enough,https://www.nytimes.com/2019/11/25/us/politics/2020-election-black-voters.html,"ATLANTA — Chyna Hester knew what she was supposed to say.

The 20-year-old Spelman College student had just attended a “Black Women’s Breakfast” featuring Kamala Harris, the Democratic presidential candidate and the second black woman elected to the United States Senate . And speaker after speaker had explicitly argued that black women should support Ms. Harris and leap at the opportunity to elevate someone with their lived experience.

But after the event on Thursday, as Beyoncé’s “Brown Skin Girl” played in the background, Ms. Hester made a sheepish admission: Ms. Harris was not her preferred choice. There were policy reasons — Ms. Harris has not rolled out a proposal on student debt cancellation, which is Ms. Hester’s top issue. But there was also something else. Even at the historically black all-women’s college that Ms. Hester attends, supporting Ms. Harris was a particularly uncool thing to do.

“It’s hard, you know. On social media, there’s a different meme about her every day,” Ms. Hester said. “A lot of young people don’t support her.”

“Why aren’t black voters supporting the black presidential candidates?” is an overly simplistic question. Like all voting blocs, black voters have diverse priorities that crisscross the ideological spectrum, creating fault lines across regions, generations and economic class. But in interviews with more than two dozen black voters in Atlanta and across South Carolina, many articulated a particular disenchantment with the idea that racial representation equated to change, and that they should automatically back a candidate who looked like them."
105,Maggie Astor,"You cant rule out that it could become an issue, said Terry Madonna, director of the Franklin &amp; Marshall College Poll in Pennsylvania, depending on the candidate and to what degree they move it forward as an issue.
The most striking change, beyond indivi… [+1352 chars]",The presidential candidates’ positions reflect a fundamental and politically consequential change in the party’s approach to reproductive issues.,2019-11-25,The New York Times,"2020 Democrats Unapologetically Support Abortion Rights, Times Survey Shows",https://www.nytimes.com/2019/11/25/us/politics/abortion-laws-2020-democrats.html,"Asked if they supported restrictions after 24 weeks — roughly when a healthy fetus can survive outside the womb, though viability varies from pregnancy to pregnancy — only Mr. Sestak said yes. (Ms. Gabbard, who did not complete the survey, has also said she supports restrictions in the third trimester.) Several candidates emphasized that less than 1 percent of abortions happen that late, often because of life-threatening conditions or severe fetal abnormalities.

Amy Klobuchar’s campaign did not fully answer the question, saying she believed “any restrictions must be consistent with Roe v. Wade.”

Roe allowed near-total bans in the third trimester as long as there was an exception for life- or health-threatening situations. Planned Parenthood v. Casey replaced the trimester framework with one based on viability, which can start in the late second trimester.

An emboldened defense

For years, the battle over the Supreme Court has been conducted in code. Republicans denounced “judicial activism” and Democrats called for justices who would “respect precedent” — that they were talking about one precedent in particular remaining unsaid.

Not anymore.

In May, Kirsten Gillibrand vowed to nominate only judges who would uphold Roe v. Wade. Though she is no longer in the race, her pledge is: All of the candidates who completed the survey said they would “require judicial nominees to support Roe v. Wade as settled law.”

Mr. Biden’s campaign brought up his role in blocking Robert Bork’s confirmation to the Supreme Court in 1987, which probably would have meant the end of Roe. Mr. Biden’s objections then were more about birth control than abortion — but his eagerness now to play up the latter is telling of how profoundly the Democratic terrain has shifted."
106,Eliza Collins,"Bernie Sanderss most adamant backers expect that he will be the Democratic nominee for president, but if it ends up looking like someone else may take that title, they want Mr. Sanders to put up a fight.
Mr. Sanderss campaign has made it clear that to win th… [+189 chars]",Bernie Sanders’s Loyal Voters Could Keep Him in Race for Months The Wall Street Journal 'SNL' mocks Joe Biden gaffes in debate recap: 'I’m always one second away from calling Cory Booker 'Barack'” Fox News 'Menus to abuse power': Biden warns against excessive…,2019-11-24,The Wall Street Journal,Bernie Sanders’s Loyal Voters Could Keep Him in Race for Months - The Wall Street Journal,https://www.wsj.com/articles/bernie-sanderss-loyal-voters-could-keep-him-in-race-for-months-11574611201,"Bernie Sanders’s most adamant backers expect that he will be the Democratic nominee for president, but if it ends up looking like someone else may take that title, they want Mr. Sanders to put up a fight.

Mr. Sanders’s campaign has made it clear that to win the nomination, he would have to pull off an ambitious expansion of the electorate. His campaign says it is banking on turning out a coalition of young, working-class and minority voters.

..."
107,,"But those clashes have now become the icebreaker in the speech she gives to Arkansas audiences.
Im just excited to have people clap when I come up to a podium, she said at a Lincoln-Reagan Day Dinner in Hot Springs one night last week. Its very different fro… [+2101 chars]","President Trump's former press secretary has returned to Arkansas a bona fide star eager to play a new role in a post-Trump Republican Party. LITTLE ROCK, Ark. - It has been less than six months since Sarah Huckabee Sanders left Washington after a tumultuous …",2019-11-25,The New York Times,"Her Battles With the Press Corps Behind Her, Sanders Plans a Political Future",https://www.nytimes.com/2019/11/24/us/politics/sarah-sanders-arkansas-governor.html,"But those clashes have now become the icebreaker in the speech she gives to Arkansas audiences.

“I’m just excited to have people clap when I come up to a podium,” she said at a Lincoln-Reagan Day Dinner in Hot Springs one night last week. “It’s very different from what I’m used to. All I can say is thank God I’m back in Arkansas.”

Ms. Sanders’s relationship with reporters reached a nadir in April after it was revealed that she had admitted under oath to investigators working for the special counsel, Robert S. Mueller III, that her claim at a press briefing that “countless members of the F.B.I.” told her they had lost confidence in the bureau’s director, James B. Comey, was a “slip of the tongue” that was not based on any facts.

In Hot Springs, the crowd was hardly dwelling on the incident.

“The main thing I like about her is her honesty,” said Carla Shelton, a small-business owner who brought her daughter to hear Ms. Sanders speak. “She got a bad rap because people are offended that she does tell the truth. I’m 100 percent behind her.”

Ms. Sanders arrived at the dinner bearing a “Make America Great Again” cap signed by Vice President Mike Pence, which was auctioned off for $750. She warned of the “chaos” that would ensue if Democrats were allowed to “take guns out of our homes” and force “taxpayer-funded abortion on demand, anytime.”

The crowd swarmed her. Her husband, Brian Sanders, drove her home.

Many of Ms. Sanders’s former White House colleagues have left Mr. Trump’s orbit damaged if not disgraced. But Ms. Sanders appears to be living her best life back home.

After two years in a rented house in Arlington, Va., the Sanders family bought a sprawling $600,000 home in Pleasant Valley, Little Rock’s wealthiest neighborhood. She has just finished building an in-house television studio for her appearances on Fox News, where she is a paid contributor, and works on a memoir due out before the 2020 election when she is not touring the country giving paid speeches and doing some corporate consulting. Her office is decorated with political paraphernalia, including a Woman of the Year award from Virginia Women for Trump and a signed electric guitar from Mr. Huckabee, which credits her with “always rocking for her Daddy!”

Her three children dote on a new puppy named Traveler Hotdog Sanders.

“Life is easier now,” Ms. Sanders is happy to acknowledge."
108,,"Democrats Spar Over Medicare for All
11/20/2019Democratic presidential hopefuls Sen. Elizabeth Warren, Sen. Bernie Sanders and former Vice President Joe Biden drew stark distinctions between their different proposals during the fifth debate. Warren and Sande… [+107 chars]",Turo lets individuals rent their personal vehicles. Some “hosts” are building businesses at airports that major car rental companies slam as unfair competition. WSJ’s Jason Bellini reports. Photo: Jake Nicol/The Wall Street Journal,2019-11-25,The Wall Street Journal,"Turo, the ‘Airbnb for Cars’, Angers Rental Car Companies",https://www.wsj.com/video/turo-the-airbnb-for-cars-angers-rental-car-companies/630DBF81-3E2E-46A5-B147-3C3AE42C53D8.html,"In the Elevator with The First Female Space Tourist

WSJ's Joanna Stern ""bumps into"" Anousheh Ansari, the CEO of XPrize and the first Iranian woman to go to space. The two discuss what's next for space tourism, whether Elon Musk is going to make it to Mars, and going to the bathroom in zero gravity. Photo: Andria Chamberlin for The Wall Street Journal"
109,,"Democrats Spar Over Medicare for All
11/20/2019Democratic presidential hopefuls Sen. Elizabeth Warren, Sen. Bernie Sanders and former Vice President Joe Biden drew stark distinctions between their different proposals during the fifth debate. Warren and Sande… [+107 chars]","After months of protests, local council elections became a test of support for the Hong Kong government. A record turnout of almost 3 million voters handed a resounding victory to the city's pro-democracy camp. Photo: Ye Aung Thu/AFP/Getty Images",2019-11-25,The Wall Street Journal,Hong Kong’s Pro-Democracy Win Puts Pressure on Government,https://www.wsj.com/video/hong-kongs-pro-democracy-win-puts-pressure-on-government/D406F93B-3E16-422E-B340-DC78B2788891.html,"In the Elevator with The First Female Space Tourist

WSJ's Joanna Stern ""bumps into"" Anousheh Ansari, the CEO of XPrize and the first Iranian woman to go to space. The two discuss what's next for space tourism, whether Elon Musk is going to make it to Mars, and going to the bathroom in zero gravity. Photo: Andria Chamberlin for The Wall Street Journal"
110,Abby Goodnough,"Nancy Downing, 42, a receptionist from Concord, said she admired Ms. Warren and Mr. Sanders for wanting to achieve free government health care for all. But she said Mr. Biden and Senator Amy Klobuchar of Minnesota, who has also proposed a public option, are m… [+2231 chars]","Anxious about the cost of a single-payer health system, more voters now support the idea of a government-run plan that would compete with private insurance.",2019-11-24,The New York Times,‘Public Option’ Draws Voters Unsure About ‘Medicare for All’,https://www.nytimes.com/2019/11/24/health/public-option-medicare-for-all.html,"Nancy Downing, 42, a receptionist from Concord, said she admired Ms. Warren and Mr. Sanders for wanting to achieve free government health care for all. But she said Mr. Biden and Senator Amy Klobuchar of Minnesota, who has also proposed a public option, are more appealing to her because they are more realistic about long-term spending.

“They’re great ideals,” Ms. Downing said of the Warren and Sanders’ “Medicare for all” plans, “but I’m just not sure we can pay for it.”

The public option plans offered by Mr. Biden and Mr. Buttigieg would require much less federal spending than Ms. Warren’s $20.5 trillion proposal to provide generous health benefits, at no cost, to all Americans. Mr. Biden has estimated his plan would cost $750 billion over 10 years; Mr. Buttigieg has said his version, which he likes to call “Medicare for all who want it,” would cost $1.5 trillion.

Mr. Biden and Mr. Buttigieg ’s plans would automatically enroll uninsured Americans in the new government health plan and allow anyone else to opt in if they wished. Both candidates would offer more generous premium subsidies than the Affordable Care Act provides and cap people’s premium costs at 8.5 percent of their income. People with premium subsidies would have deductibles of roughly $1,000 or less. Mr. Buttigieg’s plan would go a step further, retroactively enrolling anyone who had remained uninsured but ended up sick.

Although most of the other Democrats who qualified for Wednesday’s debate support the idea of a public option, few have released detailed proposals. Some candidates, like Senator Cory Booker of New Jersey and Andrew Yang, an entrepreneur, say they hope a public option would lead to “Medicare for all;” others, like Ms. Klobuchar and Tom Steyer, a former hedge fund investor and a billionaire, consider it an end in itself.

The public option that Ms. Warren has proposed as a bridge to her “Medicare for all” plan would go further. It would be free for all children and for households with incomes at or below 200 percent of the federal poverty level, which is currently about $51,000 for a family of four. For people who earn more, premiums would be capped at 5 percent of income; there would be no deductibles and “modest” out-of-pocket costs. Ms. Warren has not said how much this public option plan would cost the government, but it would be considerably less than “Medicare for all;” during Wednesday’s debate she said it would cover 135 million people — about 40 percent of the population — for free."
111,Alexander Burns,"Mr. Bloombergs candidacy has the potential to reshape the primary in a number of ways, perhaps most immediately by shaking up the contest to lead the Democratic Partys moderate wing. Former Vice President Joseph R. Biden Jr. and Mayor Pete Buttigieg of South … [+2523 chars]","Mr. Bloomberg brings a huge personal fortune and moderate views to an increasingly fluid race, but issues like criminal justice and his late start loom as vulnerabilities.",2019-11-24,The New York Times,Michael Bloomberg Enters Democratic Primary,https://www.nytimes.com/2019/11/24/us/politics/michael-bloomberg-2020-presidency.html,"Much like Mr. Biden, Mr. Bloomberg is wagering that Democratic voters will care far more about defeating Mr. Trump than any other political or ideological consideration.

Mr. Bloomberg’s message, at the start, is leaning heavily into his biography as a business executive and as the mayor of New York City starting in the aftermath of the Sept. 11, 2001, terror attacks. His advisers acknowledge that he is far less known to voters than the leading Democratic candidates. His debut television commercial stressed his credentials as a self-made executive — “a middle-class kid who made good” — and his political advocacy on core Democratic concerns like gun control and climate change, as well as on economic development and public health issues like smoking. Those issues, his advisers say, will all be central to his candidacy.

While Mr. Bloomberg is a political moderate, his opening message also borrowed in some respects from the anti-Washington rhetoric of the Democratic Party’s populist wing, led by progressives like Mr. Sanders and Senator Elizabeth Warren of Massachusetts. “I know how to take on the powerful special interests that corrupt Washington,” Mr. Bloomberg said in his statement on Sunday. “And I know how to win.”

Gov. Gina Raimondo of Rhode Island, who helms the Democratic Governors Association, said she had spoken recently with Mr. Bloomberg and saw him as a strong candidate despite the late hour. Ms. Raimondo said the former mayor recognized he faced “long odds” in the primary, but she suggested Mr. Bloomberg could be well positioned in a general election to take on Mr. Trump’s perceived credentials as a businessman.

“Trump’s a fraud. He’s a business failure. His economic policies have failed,” Ms. Raimondo said. “He’s bad for America, and I think Bloomberg can go toe-to-toe with him on that score, and he should.”"
